<?xml version="1.0" encoding="UTF-8"?>
<!DOCTYPE pagelist SYSTEM "../docs/page_list.dtd">
<pagelist>
	<category name="Main">
		<link label="Admin Home" url="admin.php"></link>
		<link label="View Site" url="index.php" target="_blank"></link>
		<link label="Configuration" module="site_config" acl="adm_site_config"></link>
	</category>
	<category name="Help">
		<link label="Help" module="help" acl="adm_help" hide="1"></link>
	</category>
	<category name="Feedback">
		<link label="Feedback" module="feedback" acl="adm_feedback" hide="1"></link>
	</category>
	<category name="Content">
		<link label="News Articles" module="news" acl="adm_news"></link>
		<link label="Newsletters" module="newsletter" acl="adm_newsletter"></link>
		<link label="Calendar" module="calendar" acl="adm_calendar"></link>
		<link label="Event Locations" module="calendar_locations" acl="adm_calendar_locations"></link>
		<link label="Manage Contacts" module="contacts_manage" acl="adm_contacts_manage"></link>
		<link label="Image Galleries" module="gallery_manager" acl="adm_gallery_manager"></link>
		<link label="Polls" module="poll_manager" acl="adm_poll_manager"></link>
		<link label="Files" module="filemanager" acl="adm_filemanager"></link>
		<link label="News Settings" module="news_settings" acl="adm_news_settings"></link>
		<link label="Gallery Settings" module="gallery_settings" acl="adm_gallery_settings"></link>
		<link label="Edit Date" module="calendar_edit_date" acl="adm_calendar_edit_date" hide="1"></link>
		<link label="Import Events" module="calendar_import" acl="adm_calendar_import" hide="1"></link>
		<link label="Poll Results" module="poll_results" acl="adm_poll_results" hide="1"></link>
	</category>
	<category name="Pages">
		<link label="Pages" module="page" acl="adm_page"></link>
		<link label="Page Messages" module="page_message" acl="adm_page_message"></link>
		<link label="Create Page Message" module="page_message_new" acl="adm_page_message_new" hide="1"></link>
		<link label="Edit Page Message" module="page_message_edit" acl="adm_page_message_edit" hide="1"></link>
	</category>
	<category name="Blocks">
		<link label="Block Manager" module="block_manager" acl="adm_block_manager"></link>
	</category>
	<category name="Users">
		<link label="Manage Users" module="user" acl="adm_user"></link>
		<link label="Edit User" module="user_edit" acl="adm_user_edit" hide="1"></link>
		<link label="Groups" module="user_groups" acl="adm_user_groups"></link>
	</category>
	<category name="Utilities">
		<link label="View Logs" module="log_view" acl="adm_log_view"></link>
		<link label="View Configuration" module="config_view" acl="adm_config_view"></link>
	</category>
</pagelist>
